{
  "all_private_string_leaves_and_json_variants": true,
  "bank_construction_attempts": 1,
  "candidate_synthetic_invocations": 0,
  "capacity_weakened": false,
  "controller_attempts": 1,
  "controller_commands_invoked": 0,
  "current_source_privacy_gate": "FAIL",
  "diagnostic_only_no_filter_reconstruction": true,
  "error": "CAPACITY",
  "failed_stage": "FULL_PRIVATE_BANK_CAPACITY",
  "failure_retried": false,
  "input_bytes_unchanged": true,
  "leaf_over_capacity": true,
  "maximum_leaf_cap_bytes": 8388608,
  "maximum_needle_bytes": 47978891,
  "needle_bank_sent_to_candidate": false,
  "needle_bank_written_to_disk": false,
  "needle_count": 6481,
  "needle_values_or_digests_exported": false,
  "needles_subsetted": false,
  "original_failure_preserved": true,
  "pattern_bytes": 285809127,
  "pattern_cap_bytes": 134217728,
  "privacy_runner_invocations": 0,
  "private_json_files": 11,
  "public_canaries_included": true,
  "schema": "cwk.rt055.amendment13-bank-diagnostic.v1",
  "status": "READONLY_DIAGNOSED_FAILURE_PRESERVED",
  "total_bank_over_capacity": true
}
